{
  "$schema": "http://json-schema.org/draft-07/schema#",
  "$id": "https://raw.githubusercontent.com/suirindo/agent-role-contracts/feat/onchain-finance-v02/schemas/financial-intent.schema.json",
  "title": "Agent Role Contracts financial-intent preview",
  "type": "object",
  "additionalProperties": false,
  "required": [
    "schema_version",
    "transaction",
    "simulation",
    "review",
    "human_approval"
  ],
  "properties": {
    "schema_version": {
      "type": "string",
      "const": "0.2"
    },
    "transaction": {
      "type": "object",
      "additionalProperties": false,
      "required": [
        "operation",
        "chain_id",
        "sender",
        "asset",
        "target",
        "amount_base_units",
        "max_fee_base_units",
        "nonce",
        "current_allowance_base_units"
      ],
      "properties": {
        "operation": {
          "type": "string",
          "enum": [
            "native_transfer",
            "erc20_transfer",
            "erc20_approve"
          ]
        },
        "chain_id": {
          "type": "string",
          "pattern": "^[1-9][0-9]*$",
          "maxLength": 78
        },
        "sender": {
          "type": "string",
          "pattern": "^0x[0-9a-fA-F]{40}$"
        },
        "asset": {
          "type": "string",
          "pattern": "^(native|0x[0-9a-fA-F]{40})$"
        },
        "target": {
          "type": "string",
          "pattern": "^0x[0-9a-fA-F]{40}$"
        },
        "amount_base_units": {
          "type": "string",
          "pattern": "^(0|[1-9][0-9]*)$",
          "maxLength": 78
        },
        "max_fee_base_units": {
          "type": "string",
          "pattern": "^(0|[1-9][0-9]*)$",
          "maxLength": 78
        },
        "nonce": {
          "type": "string",
          "pattern": "^(0|[1-9][0-9]*)$",
          "maxLength": 78
        },
        "current_allowance_base_units": {
          "type": [
            "string",
            "null"
          ],
          "pattern": "^(0|[1-9][0-9]*)$",
          "maxLength": 78
        }
      }
    },
    "simulation": {
      "type": "object",
      "additionalProperties": false,
      "required": [
        "subject_digest",
        "status",
        "chain_id",
        "block_number",
        "observed_at",
        "return_value"
      ],
      "properties": {
        "subject_digest": {
          "type": "string",
          "pattern": "^sha256:[0-9a-f]{64}$"
        },
        "status": {
          "type": "string",
          "enum": [
            "success",
            "failure"
          ]
        },
        "chain_id": {
          "type": "string",
          "pattern": "^[1-9][0-9]*$",
          "maxLength": 78
        },
        "block_number": {
          "type": "string",
          "pattern": "^(0|[1-9][0-9]*)$",
          "maxLength": 78
        },
        "observed_at": {
          "type": "string",
          "pattern": "^\\d{4}-\\d{2}-\\d{2}T\\d{2}:\\d{2}:\\d{2}(\\.\\d{3})?Z$"
        },
        "return_value": {
          "type": [
            "boolean",
            "null"
          ]
        }
      }
    },
    "review": {
      "type": "object",
      "additionalProperties": false,
      "required": [
        "subject_digest",
        "role_id",
        "decision",
        "reviewed_at"
      ],
      "properties": {
        "subject_digest": {
          "type": "string",
          "pattern": "^sha256:[0-9a-f]{64}$"
        },
        "role_id": {
          "type": "string",
          "pattern": "^[a-z0-9][a-z0-9._-]*$",
          "minLength": 1,
          "maxLength": 96
        },
        "decision": {
          "type": "string",
          "enum": [
            "pass",
            "blocked"
          ]
        },
        "reviewed_at": {
          "type": "string",
          "pattern": "^\\d{4}-\\d{2}-\\d{2}T\\d{2}:\\d{2}:\\d{2}(\\.\\d{3})?Z$"
        }
      }
    },
    "human_approval": {
      "type": "object",
      "additionalProperties": false,
      "required": [
        "subject_digest",
        "role_id",
        "decision",
        "approved_at"
      ],
      "properties": {
        "subject_digest": {
          "type": "string",
          "pattern": "^sha256:[0-9a-f]{64}$"
        },
        "role_id": {
          "type": "string",
          "pattern": "^[a-z0-9][a-z0-9._-]*$",
          "minLength": 1,
          "maxLength": 96
        },
        "decision": {
          "type": "string",
          "enum": [
            "approved",
            "denied"
          ]
        },
        "approved_at": {
          "type": "string",
          "pattern": "^\\d{4}-\\d{2}-\\d{2}T\\d{2}:\\d{2}:\\d{2}(\\.\\d{3})?Z$"
        }
      }
    }
  }
}
