{
  "schema_version": "0.2",
  "transaction": {
    "operation": "erc20_transfer",
    "chain_id": "11155111",
    "sender": "0x1111111111111111111111111111111111111111",
    "asset": "0x4444444444444444444444444444444444444444",
    "target": "0x2222222222222222222222222222222222222222",
    "amount_base_units": "250000000",
    "max_fee_base_units": "1000000000000000",
    "nonce": "7",
    "current_allowance_base_units": null
  },
  "simulation": {
    "subject_digest": "sha256:7158f9b926ed4005bbae6566bef7f5d0d1d98e3e00857aabd8f6709cab685aa1",
    "status": "success",
    "chain_id": "11155111",
    "block_number": "1234",
    "observed_at": "2030-01-01T00:00:00Z",
    "return_value": true
  },
  "review": {
    "subject_digest": "sha256:7158f9b926ed4005bbae6566bef7f5d0d1d98e3e00857aabd8f6709cab685aa1",
    "role_id": "risk-reviewer",
    "decision": "pass",
    "reviewed_at": "2030-01-01T00:00:01Z"
  },
  "human_approval": {
    "subject_digest": "sha256:7158f9b926ed4005bbae6566bef7f5d0d1d98e3e00857aabd8f6709cab685aa1",
    "role_id": "treasury-owner",
    "decision": "approved",
    "approved_at": "2030-01-01T00:00:02Z"
  }
}
